[
  {
    "schema_version": "newsletter-tagging/croda-beauty-v4",
    "article_id": "QK17IFx2SdB4JwEYXLA-1Q",
    "relevance": "relevant",
    "tagging_decision": "tagged",
    "section": {
      "primary_section": "ingredient_innovation",
      "secondary_sections": [],
      "evidence": {
        "trigger_span_id": "s8",
        "inferred_because": "neurocosmetic mechanism"
      }
    },
    "tags": {
      "primary_story_type": [
        "mechanism_research"
      ],
      "ingredient_technology": [
        "neurotransmitter_signaling",
        "dopamine"
      ],
      "functional_claim": [
        "barrier_health",
        "anti_inflammatory"
      ],
      "product_application": [
        "skincare"
      ],
      "entity_role": [
        "ecosystem"
      ]
    },
    "evidence_records": [
      {
        "field": "primary_story_type",
        "label": "mechanism_research",
        "trigger_span_id": "s8"
      },
      {
        "field": "ingredient_technology",
        "label": "neurotransmitter_signaling",
        "trigger_span_id": "s8"
      },
      {
        "field": "ingredient_technology",
        "label": "dopamine",
        "trigger_span_id": "s24"
      },
      {
        "field": "functional_claim",
        "label": "barrier_health",
        "trigger_span_id": "s12"
      },
      {
        "field": "functional_claim",
        "label": "anti_inflammatory",
        "trigger_span_id": "s29"
      }
    ],
    "suggested_new_tags": [],
    "review_reasons": [],
    "tag_audit": {
      "tagger": "opus-4.8",
      "tagged_at": "2026-06-16T12:00:00+08:00",
      "dictionary_version": "croda-beauty-2026-06-12-v4-draft",
      "prompt_version": "newsletter-tagging-prompt/croda-beauty-v4",
      "group": "B"
    }
  },
  {
    "schema_version": "newsletter-tagging/croda-beauty-v4",
    "article_id": "NxghWI8u8VafGrhh82eZXA",
    "relevance": "not_relevant",
    "tagging_decision": "excluded",
    "section": {
      "primary_section": "exclude",
      "secondary_sections": [],
      "evidence": {
        "trigger_span_id": "s0",
        "inferred_because": "consumer promo bundle sale"
      }
    },
    "tags": {
      "primary_story_type": [
        "consumer_promotion"
      ],
      "ingredient_technology": [],
      "functional_claim": [],
      "product_application": [
        "skincare"
      ],
      "entity_role": [
        "channel"
      ]
    },
    "evidence_records": [
      {
        "field": "primary_story_type",
        "label": "consumer_promotion",
        "trigger_span_id": "s1"
      }
    ],
    "suggested_new_tags": [],
    "review_reasons": [],
    "tag_audit": {
      "tagger": "opus-4.8",
      "tagged_at": "2026-06-16T12:00:00+08:00",
      "dictionary_version": "croda-beauty-2026-06-12-v4-draft",
      "prompt_version": "newsletter-tagging-prompt/croda-beauty-v4",
      "group": "B"
    }
  },
  {
    "schema_version": "newsletter-tagging/croda-beauty-v4",
    "article_id": "qOjLL7gbW3andtAfCjLV2Q",
    "relevance": "relevant",
    "tagging_decision": "tagged",
    "section": {
      "primary_section": "market_event",
      "secondary_sections": [
        "ka_watch"
      ],
      "evidence": {
        "trigger_span_id": "s5",
        "inferred_because": "sensitive-skin market trend"
      }
    },
    "tags": {
      "primary_story_type": [
        "market_trend"
      ],
      "ingredient_technology": [],
      "functional_claim": [
        "soothing",
        "whitening",
        "anti_aging",
        "sunscreen"
      ],
      "product_application": [
        "sensitive_skincare"
      ],
      "entity_role": [
        "customer",
        "ecosystem"
      ]
    },
    "evidence_records": [
      {
        "field": "primary_story_type",
        "label": "market_trend",
        "trigger_span_id": "s5"
      },
      {
        "field": "functional_claim",
        "label": "soothing",
        "trigger_span_id": "s17"
      },
      {
        "field": "functional_claim",
        "label": "whitening",
        "trigger_span_id": "s29"
      },
      {
        "field": "functional_claim",
        "label": "anti_aging",
        "trigger_span_id": "s38"
      },
      {
        "field": "product_application",
        "label": "sensitive_skincare",
        "trigger_span_id": "s7"
      }
    ],
    "suggested_new_tags": [],
    "review_reasons": [],
    "tag_audit": {
      "tagger": "opus-4.8",
      "tagged_at": "2026-06-16T12:00:00+08:00",
      "dictionary_version": "croda-beauty-2026-06-12-v4-draft",
      "prompt_version": "newsletter-tagging-prompt/croda-beauty-v4",
      "group": "B"
    }
  },
  {
    "schema_version": "newsletter-tagging/croda-beauty-v4",
    "article_id": "XGItt9v6lEIzSYsQmpdhOw",
    "relevance": "relevant",
    "tagging_decision": "tagged",
    "section": {
      "primary_section": "ingredient_innovation",
      "secondary_sections": [
        "market_event"
      ],
      "evidence": {
        "trigger_span_id": "s1",
        "inferred_because": "new ingredient registrations"
      }
    },
    "tags": {
      "primary_story_type": [
        "new_ingredient_registration",
        "ingredient_trend"
      ],
      "ingredient_technology": [
        "plant_extract",
        "fermentation",
        "synthetic_biology",
        "marine_peptide"
      ],
      "functional_claim": [],
      "product_application": [
        "skincare"
      ],
      "entity_role": [
        "competitor",
        "ecosystem"
      ]
    },
    "evidence_records": [
      {
        "field": "primary_story_type",
        "label": "new_ingredient_registration",
        "trigger_span_id": "s1"
      },
      {
        "field": "ingredient_technology",
        "label": "plant_extract",
        "trigger_span_id": "s5"
      },
      {
        "field": "ingredient_technology",
        "label": "synthetic_biology",
        "trigger_span_id": "s13"
      },
      {
        "field": "ingredient_technology",
        "label": "fermentation",
        "trigger_span_id": "s19"
      },
      {
        "field": "primary_story_type",
        "label": "ingredient_trend",
        "trigger_span_id": "s20"
      }
    ],
    "suggested_new_tags": [],
    "review_reasons": [],
    "tag_audit": {
      "tagger": "opus-4.8",
      "tagged_at": "2026-06-16T12:00:00+08:00",
      "dictionary_version": "croda-beauty-2026-06-12-v4-draft",
      "prompt_version": "newsletter-tagging-prompt/croda-beauty-v4",
      "group": "B"
    }
  },
  {
    "schema_version": "newsletter-tagging/croda-beauty-v4",
    "article_id": "jqap8D1xBVDQk2i2L_2SoQ",
    "relevance": "relevant",
    "tagging_decision": "tagged",
    "section": {
      "primary_section": "ka_watch",
      "secondary_sections": [],
      "evidence": {
        "trigger_span_id": "s28",
        "inferred_because": "brand proprietary oil-control tech"
      }
    },
    "tags": {
      "primary_story_type": [
        "brand_strategy",
        "proprietary_technology"
      ],
      "ingredient_technology": [
        "ampk_oil_control",
        "thermus_ferment"
      ],
      "functional_claim": [
        "oil_control",
        "sebum_regulation"
      ],
      "product_application": [
        "mens_skincare"
      ],
      "entity_role": [
        "customer"
      ]
    },
    "evidence_records": [
      {
        "field": "primary_story_type",
        "label": "brand_strategy",
        "trigger_span_id": "s11"
      },
      {
        "field": "primary_story_type",
        "label": "proprietary_technology",
        "trigger_span_id": "s28"
      },
      {
        "field": "ingredient_technology",
        "label": "ampk_oil_control",
        "trigger_span_id": "s28"
      },
      {
        "field": "ingredient_technology",
        "label": "thermus_ferment",
        "trigger_span_id": "s35"
      },
      {
        "field": "functional_claim",
        "label": "oil_control",
        "trigger_span_id": "s29"
      },
      {
        "field": "product_application",
        "label": "mens_skincare",
        "trigger_span_id": "s4"
      }
    ],
    "suggested_new_tags": [],
    "review_reasons": [],
    "tag_audit": {
      "tagger": "opus-4.8",
      "tagged_at": "2026-06-16T12:00:00+08:00",
      "dictionary_version": "croda-beauty-2026-06-12-v4-draft",
      "prompt_version": "newsletter-tagging-prompt/croda-beauty-v4",
      "group": "B"
    }
  },
  {
    "schema_version": "newsletter-tagging/croda-beauty-v4",
    "article_id": "fGhwLgCP5oKEOFag0nCouA",
    "relevance": "relevant",
    "tagging_decision": "tagged",
    "section": {
      "primary_section": "ka_watch",
      "secondary_sections": [
        "ingredient_innovation"
      ],
      "evidence": {
        "trigger_span_id": "s36",
        "inferred_because": "brand photoaging mechanism research"
      }
    },
    "tags": {
      "primary_story_type": [
        "mechanism_research",
        "brand_strategy"
      ],
      "ingredient_technology": [
        "glycation_biomarker",
        "st6gal1",
        "arbutin"
      ],
      "functional_claim": [
        "anti_photoaging",
        "whitening"
      ],
      "product_application": [
        "skincare"
      ],
      "entity_role": [
        "customer"
      ]
    },
    "evidence_records": [
      {
        "field": "primary_story_type",
        "label": "mechanism_research",
        "trigger_span_id": "s36"
      },
      {
        "field": "ingredient_technology",
        "label": "glycation_biomarker",
        "trigger_span_id": "s35"
      },
      {
        "field": "ingredient_technology",
        "label": "st6gal1",
        "trigger_span_id": "s36"
      },
      {
        "field": "functional_claim",
        "label": "anti_photoaging",
        "trigger_span_id": "s40"
      },
      {
        "field": "functional_claim",
        "label": "whitening",
        "trigger_span_id": "s44"
      },
      {
        "field": "primary_story_type",
        "label": "brand_strategy",
        "trigger_span_id": "s9"
      }